{
  "taskId": "build-slice-register-organization",
  "workspacePath": "../generated/axon",
  "modelPath": "./examples/fl/federation-learning.medol",
  "codegenModelPath": "../code-generator/example/codegen-model.json",
  "sliceId": "register-organization",
  "target": "axon",
  "mode": "modify",
  "acceptanceCriteria": [
    "RegisterOrganization command accepts valid organization data.",
    "Duplicate active organization names are rejected according to MEDOL specifications.",
    "OrganizationRegistered is emitted for accepted registration.",
    "Relevant backend tests pass."
  ],
  "notes": "Use generated Axon structure as the foundation. Do not rewrite MEDOL unless a model issue blocks implementation."
}
